{
  "$schema": "https://json-schema.org/draft/2020-12/schema",
  "$id": "https://schemas.ardyn.ai/boundary-maps/ardyn.phase-5.24.prerequisite-evaluation-integration-checkpoint.schema.json",
  "title": "ARDYN Boundary Map: ardyn.phase-5.24.prerequisite-evaluation-integration-checkpoint",
  "description": "Auto-generated JSON Schema for boundary-map artifact validation. Enforces shape + safety invariants.",
  "type": "object",
  "required": [
    "schema",
    "schemaVersion",
    "phase",
    "artifactKind",
    "metadataGeneratedAt",
    "sourcePhase",
    "integrationSummary",
    "integrationInputShape",
    "integrationResultShape",
    "integrationCheckpointCases",
    "pipelineStageIntegration",
    "blockedRuntimeEffect",
    "serveRuntimeBlockedBehavior",
    "forbiddenBehavior",
    "filesAllowedToChange",
    "filesForbiddenToChange",
    "validationCommands"
  ],
  "properties": {
    "schema": {
      "type": "string",
      "const": "ardyn.phase-5.24.prerequisite-evaluation-integration-checkpoint"
    },
    "schemaVersion": {
      "type": "string"
    },
    "phase": {
      "type": "string"
    },
    "artifactKind": {
      "type": "string"
    },
    "metadataGeneratedAt": {
      "type": "string"
    },
    "sourcePhase": {
      "type": "object"
    },
    "integrationSummary": {
      "type": "object"
    },
    "integrationInputShape": {
      "type": "object"
    },
    "integrationResultShape": {
      "type": "object"
    },
    "integrationCheckpointCases": {
      "type": "array"
    },
    "pipelineStageIntegration": {
      "type": "object"
    },
    "blockedRuntimeEffect": {
      "type": "object"
    },
    "serveRuntimeBlockedBehavior": {
      "type": "object"
    },
    "forbiddenBehavior": {
      "type": "array"
    },
    "filesAllowedToChange": {
      "type": "array"
    },
    "filesForbiddenToChange": {
      "type": "array"
    },
    "validationCommands": {
      "type": "array"
    }
  },
  "additionalProperties": true
}
