{
  "schema": "ardyn.phase-5.24.prerequisite-evaluation-integration-checkpoint",
  "schemaVersion": "0.1.0",
  "phase": "phase-5.24-prerequisite-evaluation-integration-checkpoint",
  "artifactKind": "prerequisite-evaluation-integration-checkpoint",
  "metadataGeneratedAt": "1970-01-01T00:00:00.000Z",
  "sourcePhase": {
    "phase": "phase-5.23-prerequisite-bundle-consumption-checkpoint",
    "sourceIngestionPath": "packages/core/src/index.mjs#preflightApprovalPrerequisiteSourcesForReview",
    "sourceSelectionPath": "packages/core/src/index.mjs#selectApprovalPrerequisiteSourcesForReview",
    "sourceBundlePath": "packages/core/src/index.mjs#bundleApprovalPrerequisiteSourcesForReview",
    "bundleConsumptionPath": "packages/core/src/index.mjs#consumeApprovalPrerequisiteBundleForReview",
    "integrationCheckpointPath": "packages/core/src/index.mjs#evaluatePrerequisiteIntegrationCheckpointForReview",
    "reviewOnlyEvaluatorPath": "packages/core/src/index.mjs#evaluateRuntimeApprovalPrerequisitesForReview",
    "runtimeEnabled": false,
    "approvalGrantProduced": false
  },
  "integrationSummary": {
    "integrationCheckpointRecorded": true,
    "checkpointKind": "approval-prerequisite-evaluation-integration-checkpoint",
    "checkpointReviewOnly": true,
    "checkpointAuthoritative": false,
    "sourceIngestionConnected": true,
    "sourceSelectionConnected": true,
    "sourceBundlingConnected": true,
    "bundleConsumptionConnected": true,
    "reviewOnlyEvaluatorSummaryConnected": true,
    "missingPrerequisiteInputsRejected": true,
    "malformedPrerequisiteInputsRejected": true,
    "emptyPrerequisiteInputsRejected": true,
    "conflictingPrerequisiteInputsRejected": true,
    "stalePrerequisiteInputsRejected": true,
    "revokedPrerequisiteInputsRejected": true,
    "unknownPrerequisiteInputsRejected": true,
    "duplicatePrerequisiteInputsRejected": true,
    "validPrerequisiteInputsProduceReviewSummary": true,
    "reviewSummaryIsApprovalGrant": false,
    "approvalGrantProduced": false,
    "approvalGrantPersisted": false,
    "runtimeEnabled": false,
    "runtimeCommandEnabled": false,
    "runtimeCommandExposureEnabled": false,
    "runtimeExecutionEnabled": false,
    "serveRuntimeStillDefaultBlocked": true,
    "dryRunBypassesBlock": false,
    "canEnableRuntime": false
  },
  "integrationInputShape": {
    "sourceInputsRequired": true,
    "sourceKind": "inline-prerequisite-records",
    "sourceMode": "in-memory",
    "sourceSelectionPolicy": "deterministic-lowest-source-id-for-equivalent-valid-sources",
    "sourceBundlePartId": "phase-5.24-selected-prerequisite-sources",
    "bundleModeRequired": "review-only",
    "conflictingInputPolicy": "fail-closed",
    "filesystemWatcherAllowed": false,
    "externalSourceLookupAllowed": false,
    "secretsEnvIngestionAllowed": false,
    "filePathAllowed": false,
    "urlAllowed": false
  },
  "integrationResultShape": {
    "schema": "ardyn.phase-5.24.approval-prerequisite-integration-checkpoint-result",
    "schemaVersion": "0.1.0",
    "checkpointKind": "approval-prerequisite-evaluation-integration-checkpoint",
    "checkpointMode": "review-only",
    "reviewOnly": true,
    "authoritative": false,
    "validInputsMayProduceReviewSummary": true,
    "reviewSummaryIsApprovalGrant": false,
    "approvalGrantProduced": false,
    "approvalGrantPersisted": false,
    "runtimeEffectAllFalse": true
  },
  "integrationCheckpointCases": [
    {
      "caseId": "missing-prerequisite-input-rejected",
      "classification": "missing_prerequisite_integration_input_rejected",
      "reviewSummaryProduced": false,
      "reviewSummaryIsApprovalGrant": false,
      "reviewOnly": true,
      "authoritative": false,
      "approvalGrant": {
        "produced": false,
        "persisted": false,
        "grantId": null
      },
      "runtimeEffect": {
        "runtimeEnabled": false,
        "runtimeStarted": false,
        "runtimeReady": false,
        "runtimeCommandEnabled": false,
        "runtimeCommandExposureEnabled": false,
        "runtimeExecutionEnabled": false,
        "runtimeExecuted": false,
        "approvalGrantProduced": false,
        "approvalGrantPersisted": false,
        "approvalEvaluatorAuthoritative": false
      }
    },
    {
      "caseId": "malformed-prerequisite-input-rejected",
      "classification": "malformed_prerequisite_integration_input_rejected",
      "reviewSummaryProduced": false,
      "reviewSummaryIsApprovalGrant": false,
      "reviewOnly": true,
      "authoritative": false,
      "approvalGrant": {
        "produced": false,
        "persisted": false,
        "grantId": null
      },
      "runtimeEffect": {
        "runtimeEnabled": false,
        "runtimeStarted": false,
        "runtimeReady": false,
        "runtimeCommandEnabled": false,
        "runtimeCommandExposureEnabled": false,
        "runtimeExecutionEnabled": false,
        "runtimeExecuted": false,
        "approvalGrantProduced": false,
        "approvalGrantPersisted": false,
        "approvalEvaluatorAuthoritative": false
      }
    },
    {
      "caseId": "empty-prerequisite-input-rejected",
      "classification": "empty_prerequisite_integration_input_rejected",
      "reviewSummaryProduced": false,
      "reviewSummaryIsApprovalGrant": false,
      "reviewOnly": true,
      "authoritative": false,
      "approvalGrant": {
        "produced": false,
        "persisted": false,
        "grantId": null
      },
      "runtimeEffect": {
        "runtimeEnabled": false,
        "runtimeStarted": false,
        "runtimeReady": false,
        "runtimeCommandEnabled": false,
        "runtimeCommandExposureEnabled": false,
        "runtimeExecutionEnabled": false,
        "runtimeExecuted": false,
        "approvalGrantProduced": false,
        "approvalGrantPersisted": false,
        "approvalEvaluatorAuthoritative": false
      }
    },
    {
      "caseId": "conflicting-prerequisite-input-rejected",
      "classification": "conflicting_prerequisite_integration_input_rejected",
      "reviewSummaryProduced": false,
      "reviewSummaryIsApprovalGrant": false,
      "reviewOnly": true,
      "authoritative": false,
      "approvalGrant": {
        "produced": false,
        "persisted": false,
        "grantId": null
      },
      "runtimeEffect": {
        "runtimeEnabled": false,
        "runtimeStarted": false,
        "runtimeReady": false,
        "runtimeCommandEnabled": false,
        "runtimeCommandExposureEnabled": false,
        "runtimeExecutionEnabled": false,
        "runtimeExecuted": false,
        "approvalGrantProduced": false,
        "approvalGrantPersisted": false,
        "approvalEvaluatorAuthoritative": false
      }
    },
    {
      "caseId": "stale-prerequisite-input-rejected",
      "classification": "stale_prerequisite_integration_input_rejected",
      "reviewSummaryProduced": false,
      "reviewSummaryIsApprovalGrant": false,
      "reviewOnly": true,
      "authoritative": false,
      "approvalGrant": {
        "produced": false,
        "persisted": false,
        "grantId": null
      },
      "runtimeEffect": {
        "runtimeEnabled": false,
        "runtimeStarted": false,
        "runtimeReady": false,
        "runtimeCommandEnabled": false,
        "runtimeCommandExposureEnabled": false,
        "runtimeExecutionEnabled": false,
        "runtimeExecuted": false,
        "approvalGrantProduced": false,
        "approvalGrantPersisted": false,
        "approvalEvaluatorAuthoritative": false
      }
    },
    {
      "caseId": "revoked-prerequisite-input-rejected",
      "classification": "revoked_prerequisite_integration_input_rejected",
      "reviewSummaryProduced": false,
      "reviewSummaryIsApprovalGrant": false,
      "reviewOnly": true,
      "authoritative": false,
      "approvalGrant": {
        "produced": false,
        "persisted": false,
        "grantId": null
      },
      "runtimeEffect": {
        "runtimeEnabled": false,
        "runtimeStarted": false,
        "runtimeReady": false,
        "runtimeCommandEnabled": false,
        "runtimeCommandExposureEnabled": false,
        "runtimeExecutionEnabled": false,
        "runtimeExecuted": false,
        "approvalGrantProduced": false,
        "approvalGrantPersisted": false,
        "approvalEvaluatorAuthoritative": false
      }
    },
    {
      "caseId": "unknown-prerequisite-input-rejected",
      "classification": "unknown_prerequisite_integration_input_rejected",
      "reviewSummaryProduced": false,
      "reviewSummaryIsApprovalGrant": false,
      "reviewOnly": true,
      "authoritative": false,
      "approvalGrant": {
        "produced": false,
        "persisted": false,
        "grantId": null
      },
      "runtimeEffect": {
        "runtimeEnabled": false,
        "runtimeStarted": false,
        "runtimeReady": false,
        "runtimeCommandEnabled": false,
        "runtimeCommandExposureEnabled": false,
        "runtimeExecutionEnabled": false,
        "runtimeExecuted": false,
        "approvalGrantProduced": false,
        "approvalGrantPersisted": false,
        "approvalEvaluatorAuthoritative": false
      }
    },
    {
      "caseId": "duplicate-prerequisite-input-rejected",
      "classification": "duplicate_prerequisite_integration_input_rejected",
      "reviewSummaryProduced": false,
      "reviewSummaryIsApprovalGrant": false,
      "reviewOnly": true,
      "authoritative": false,
      "approvalGrant": {
        "produced": false,
        "persisted": false,
        "grantId": null
      },
      "runtimeEffect": {
        "runtimeEnabled": false,
        "runtimeStarted": false,
        "runtimeReady": false,
        "runtimeCommandEnabled": false,
        "runtimeCommandExposureEnabled": false,
        "runtimeExecutionEnabled": false,
        "runtimeExecuted": false,
        "approvalGrantProduced": false,
        "approvalGrantPersisted": false,
        "approvalEvaluatorAuthoritative": false
      }